source,claim_index,sentence_index,claim_text,claim_kind,support_status,evidence_present,falsifiability_present,dependency_present,hedge_present,absolute_overreach,local_contradiction,precision_present,claim_status,claim_score
O:\_Theophysics_v4\04_THEOPYHISCS\[TX_A6.6] THE CONVERGENCE\THE CONVERGENCE 1 Story\A3_ARCHIVE\What Separates Us (old draft).md,0,0,"*[Convergence](https://convergence.substack.com) — where physics meets theology and the math doesn't flinch.*

---

Everybody's got a theory about what's tearing this country apart.",descriptive,under-supported,False,False,False,False,False,False,False,under-supported,0.458
O:\_Theophysics_v4\04_THEOPYHISCS\[TX_A6.6] THE CONVERGENCE\THE CONVERGENCE 1 Story\A3_ARCHIVE\What Separates Us (old draft).md,1,8,"There are at least six divides splitting America right now, and every one of them feels like THE divide if you're standing inside it.",descriptive,under-supported,False,False,False,False,False,False,False,under-supported,0.5087
O:\_Theophysics_v4\04_THEOPYHISCS\[TX_A6.6] THE CONVERGENCE\THE CONVERGENCE 1 Story\A3_ARCHIVE\What Separates Us (old draft).md,2,13,"Your party affiliation predicts where you live, who you marry, what you drive, what you eat for breakfast.",predictive,under-supported,False,False,False,False,False,False,False,under-supported,0.462
O:\_Theophysics_v4\04_THEOPYHISCS\[TX_A6.6] THE CONVERGENCE\THE CONVERGENCE 1 Story\A3_ARCHIVE\What Separates Us (old draft).md,3,17,**Urban vs Rural.** Drive thirty minutes outside any major city and you're in a different country.,descriptive,under-supported,False,False,False,False,False,False,False,under-supported,0.4527
O:\_Theophysics_v4\04_THEOPYHISCS\[TX_A6.6] THE CONVERGENCE\THE CONVERGENCE 1 Story\A3_ARCHIVE\What Separates Us (old draft).md,4,20,The relationship to institutions is different.,descriptive,under-supported,False,False,False,False,False,False,False,under-supported,0.4527
O:\_Theophysics_v4\04_THEOPYHISCS\[TX_A6.6] THE CONVERGENCE\THE CONVERGENCE 1 Story\A3_ARCHIVE\What Separates Us (old draft).md,5,23,They're not arguing about the same things — they're arguing from different planets about what counts as evidence.,descriptive,under-supported,False,False,False,False,False,False,False,under-supported,0.5047
O:\_Theophysics_v4\04_THEOPYHISCS\[TX_A6.6] THE CONVERGENCE\THE CONVERGENCE 1 Story\A3_ARCHIVE\What Separates Us (old draft).md,6,24,**College vs Non-College.** This one's quiet but it might be the deepest.,descriptive,speculative,False,False,False,True,False,False,False,speculative,0.181
O:\_Theophysics_v4\04_THEOPYHISCS\[TX_A6.6] THE CONVERGENCE\THE CONVERGENCE 1 Story\A3_ARCHIVE\What Separates Us (old draft).md,7,25,"A four-year degree has become the single strongest predictor of how you vote, what media you consume, what you think about immigration, and how you raise your kids.",predictive,under-supported,False,False,False,False,False,False,False,under-supported,0.406
O:\_Theophysics_v4\04_THEOPYHISCS\[TX_A6.6] THE CONVERGENCE\THE CONVERGENCE 1 Story\A3_ARCHIVE\What Separates Us (old draft).md,8,26,And here's the thing that makes it toxic — each side thinks the other one is stupid.,descriptive,under-supported,False,False,False,False,False,False,False,under-supported,0.462
O:\_Theophysics_v4\04_THEOPYHISCS\[TX_A6.6] THE CONVERGENCE\THE CONVERGENCE 1 Story\A3_ARCHIVE\What Separates Us (old draft).md,9,27,The credentialed think the uncredentialed are ignorant.,descriptive,under-supported,False,False,False,False,False,False,False,under-supported,0.406
O:\_Theophysics_v4\04_THEOPYHISCS\[TX_A6.6] THE CONVERGENCE\THE CONVERGENCE 1 Story\A3_ARCHIVE\What Separates Us (old draft).md,10,28,The uncredentialed think the credentialed are brainwashed.,descriptive,under-supported,False,False,False,False,False,False,False,under-supported,0.406
O:\_Theophysics_v4\04_THEOPYHISCS\[TX_A6.6] THE CONVERGENCE\THE CONVERGENCE 1 Story\A3_ARCHIVE\What Separates Us (old draft).md,11,31,**Rich vs Poor.** The wealth gap is obvious.,descriptive,under-supported,False,False,False,False,False,False,False,under-supported,0.406
O:\_Theophysics_v4\04_THEOPYHISCS\[TX_A6.6] THE CONVERGENCE\THE CONVERGENCE 1 Story\A3_ARCHIVE\What Separates Us (old draft).md,12,33,Whether you have a cushion or whether one bad month puts you on the street.,descriptive,under-supported,False,False,False,False,False,False,False,under-supported,0.406
O:\_Theophysics_v4\04_THEOPYHISCS\[TX_A6.6] THE CONVERGENCE\THE CONVERGENCE 1 Story\A3_ARCHIVE\What Separates Us (old draft).md,13,38,Two people looking at the same policy proposal from those two positions aren't evaluating the same thing.,descriptive,under-supported,False,False,False,False,False,False,False,under-supported,0.406
O:\_Theophysics_v4\04_THEOPYHISCS\[TX_A6.6] THE CONVERGENCE\THE CONVERGENCE 1 Story\A3_ARCHIVE\What Separates Us (old draft).md,14,40,"**Religious vs Secular.** Not just ""do you go to church"" but something deeper — whether you think traditional structures are sources of meaning or sources of oppression.",descriptive,under-supported,False,False,False,False,False,False,False,under-supported,0.462
O:\_Theophysics_v4\04_THEOPYHISCS\[TX_A6.6] THE CONVERGENCE\THE CONVERGENCE 1 Story\A3_ARCHIVE\What Separates Us (old draft).md,15,43,"And the fights over curriculum, gender, patriotism, history — every one of those fights is a proxy war for this question: *Is the thing our grandparents built worth keeping, or worth tearing down?*

**Boomers vs Everyone Younger.** Different economic realities.",descriptive,under-supported,False,False,False,False,False,False,False,under-supported,0.5647
O:\_Theophysics_v4\04_THEOPYHISCS\[TX_A6.6] THE CONVERGENCE\THE CONVERGENCE 1 Story\A3_ARCHIVE\What Separates Us (old draft).md,16,49,They're looking at the receipt and the math doesn't add up.,descriptive,under-supported,False,False,False,False,False,False,False,under-supported,0.406
O:\_Theophysics_v4\04_THEOPYHISCS\[TX_A6.6] THE CONVERGENCE\THE CONVERGENCE 1 Story\A3_ARCHIVE\What Separates Us (old draft).md,17,50,"When the older generation says ""we built this,"" the younger generation says ""yeah, and we're paying for it."" Both are telling the truth.",descriptive,under-supported,False,False,False,False,False,False,False,under-supported,0.462
O:\_Theophysics_v4\04_THEOPYHISCS\[TX_A6.6] THE CONVERGENCE\THE CONVERGENCE 1 Story\A3_ARCHIVE\What Separates Us (old draft).md,18,52,Every one of them is real.,descriptive,under-supported,False,False,False,False,False,False,False,under-supported,0.406
O:\_Theophysics_v4\04_THEOPYHISCS\[TX_A6.6] THE CONVERGENCE\THE CONVERGENCE 1 Story\A3_ARCHIVE\What Separates Us (old draft).md,19,55,"If you spend enough time inside any one of these fights, you start to notice that the *shape* of the fight is the same every time.",descriptive,under-supported,False,False,False,False,False,False,False,under-supported,0.5087
O:\_Theophysics_v4\04_THEOPYHISCS\[TX_A6.6] THE CONVERGENCE\THE CONVERGENCE 1 Story\A3_ARCHIVE\What Separates Us (old draft).md,20,56,"The content changes — money, education, religion, geography — but the architecture doesn't.",descriptive,under-supported,False,False,False,False,False,False,False,under-supported,0.406
O:\_Theophysics_v4\04_THEOPYHISCS\[TX_A6.6] THE CONVERGENCE\THE CONVERGENCE 1 Story\A3_ARCHIVE\What Separates Us (old draft).md,21,58,Each one can see something true that the other one can't.,descriptive,under-supported,False,False,False,False,False,False,False,under-supported,0.406
O:\_Theophysics_v4\04_THEOPYHISCS\[TX_A6.6] THE CONVERGENCE\THE CONVERGENCE 1 Story\A3_ARCHIVE\What Separates Us (old draft).md,22,60,"And the identity has become more important than the truth it was built on.*

Read that again.",descriptive,under-supported,False,False,False,False,False,False,False,under-supported,0.406
O:\_Theophysics_v4\04_THEOPYHISCS\[TX_A6.6] THE CONVERGENCE\THE CONVERGENCE 1 Story\A3_ARCHIVE\What Separates Us (old draft).md,23,63,The divide is between *truth and identity.* Every time.,descriptive,under-supported,False,False,False,False,False,False,False,under-supported,0.406
O:\_Theophysics_v4\04_THEOPYHISCS\[TX_A6.6] THE CONVERGENCE\THE CONVERGENCE 1 Story\A3_ARCHIVE\What Separates Us (old draft).md,24,64,"The moment a true observation becomes a tribal badge, it stops being about the truth and starts being about the tribe.",descriptive,under-supported,False,False,False,False,False,False,False,under-supported,0.406
O:\_Theophysics_v4\04_THEOPYHISCS\[TX_A6.6] THE CONVERGENCE\THE CONVERGENCE 1 Story\A3_ARCHIVE\What Separates Us (old draft).md,25,65,And the tribe will defend the badge long after the truth underneath it has been distorted beyond recognition.,predictive,under-supported,False,False,False,False,False,False,False,under-supported,0.4527
O:\_Theophysics_v4\04_THEOPYHISCS\[TX_A6.6] THE CONVERGENCE\THE CONVERGENCE 1 Story\A3_ARCHIVE\What Separates Us (old draft).md,26,66,The Democrat who started by noticing real inequality ends up defending policies that make it worse — because the badge matters more than the problem now.,causal,under-supported,False,False,True,False,False,False,False,under-supported,0.4993
O:\_Theophysics_v4\04_THEOPYHISCS\[TX_A6.6] THE CONVERGENCE\THE CONVERGENCE 1 Story\A3_ARCHIVE\What Separates Us (old draft).md,27,67,The Republican who started by noticing real overreach ends up defending power structures that are just as invasive — because the badge matters more than the principle.,causal,under-supported,False,False,True,False,False,False,False,under-supported,0.5553
O:\_Theophysics_v4\04_THEOPYHISCS\[TX_A6.6] THE CONVERGENCE\THE CONVERGENCE 1 Story\A3_ARCHIVE\What Separates Us (old draft).md,28,68,The religious person who started by noticing real transcendence ends up defending institutions that have lost it.,descriptive,under-supported,False,False,False,False,False,False,False,under-supported,0.406
O:\_Theophysics_v4\04_THEOPYHISCS\[TX_A6.6] THE CONVERGENCE\THE CONVERGENCE 1 Story\A3_ARCHIVE\What Separates Us (old draft).md,29,69,The secular person who started by noticing real abuse ends up destroying structures that were never the source of the problem.,descriptive,overstated,False,False,False,False,True,False,False,overstated,0.3437
O:\_Theophysics_v4\04_THEOPYHISCS\[TX_A6.6] THE CONVERGENCE\THE CONVERGENCE 1 Story\A3_ARCHIVE\What Separates Us (old draft).md,30,71,"If all six divides run the same architecture — if the structure is always ""partial truth captured by identity and weaponized against the other side"" — then the divides aren't the problem.",descriptive,overstated,False,False,False,False,True,False,False,overstated,0.4287
O:\_Theophysics_v4\04_THEOPYHISCS\[TX_A6.6] THE CONVERGENCE\THE CONVERGENCE 1 Story\A3_ARCHIVE\What Separates Us (old draft).md,31,73,I've spent the last fifteen months building a mathematical framework that keeps asking that question across every domain I can throw at it.,descriptive,under-supported,False,False,False,False,False,False,False,under-supported,0.4527
O:\_Theophysics_v4\04_THEOPYHISCS\[TX_A6.6] THE CONVERGENCE\THE CONVERGENCE 1 Story\A3_ARCHIVE\What Separates Us (old draft).md,32,75,"Here's what the pattern says:

There are exactly two directions anything can move.",descriptive,under-supported,False,False,False,False,False,False,False,under-supported,0.462
O:\_Theophysics_v4\04_THEOPYHISCS\[TX_A6.6] THE CONVERGENCE\THE CONVERGENCE 1 Story\A3_ARCHIVE\What Separates Us (old draft).md,33,76,"Toward coherence — where parts align, information increases, structure builds, and relationships deepen.",descriptive,under-supported,False,False,False,False,False,False,False,under-supported,0.406
O:\_Theophysics_v4\04_THEOPYHISCS\[TX_A6.6] THE CONVERGENCE\THE CONVERGENCE 1 Story\A3_ARCHIVE\What Separates Us (old draft).md,34,77,"Or toward fragmentation — where parts separate, information degrades, structure dissolves, and relationships collapse.",descriptive,under-supported,False,False,False,False,False,False,False,under-supported,0.406
O:\_Theophysics_v4\04_THEOPYHISCS\[TX_A6.6] THE CONVERGENCE\THE CONVERGENCE 1 Story\A3_ARCHIVE\What Separates Us (old draft).md,35,79,The physicist calls it the second law of thermodynamics — entropy always increases in a closed system.,descriptive,overstated,False,False,False,False,True,False,False,overstated,0.256
O:\_Theophysics_v4\04_THEOPYHISCS\[TX_A6.6] THE CONVERGENCE\THE CONVERGENCE 1 Story\A3_ARCHIVE\What Separates Us (old draft).md,36,80,Things fall apart unless energy is put in to hold them together.,descriptive,under-supported,False,False,False,False,False,False,False,under-supported,0.462
O:\_Theophysics_v4\04_THEOPYHISCS\[TX_A6.6] THE CONVERGENCE\THE CONVERGENCE 1 Story\A3_ARCHIVE\What Separates Us (old draft).md,37,81,Every one of those six divides is entropy winning.,descriptive,under-supported,False,False,False,False,False,False,False,under-supported,0.406
O:\_Theophysics_v4\04_THEOPYHISCS\[TX_A6.6] THE CONVERGENCE\THE CONVERGENCE 1 Story\A3_ARCHIVE\What Separates Us (old draft).md,38,82,Not because the people inside them are evil.,causal,under-supported,False,False,True,False,False,False,False,under-supported,0.4993
O:\_Theophysics_v4\04_THEOPYHISCS\[TX_A6.6] THE CONVERGENCE\THE CONVERGENCE 1 Story\A3_ARCHIVE\What Separates Us (old draft).md,39,85,"And here's the part I can't get past:

The fragmentation is accelerating.",descriptive,under-supported,False,False,False,False,False,False,False,under-supported,0.462
O:\_Theophysics_v4\04_THEOPYHISCS\[TX_A6.6] THE CONVERGENCE\THE CONVERGENCE 1 Story\A3_ARCHIVE\What Separates Us (old draft).md,40,86,"*Directionally.* The divides aren't just appearing — they're deepening, multiplying, feeding each other.",descriptive,under-supported,False,False,False,False,False,False,False,under-supported,0.406
O:\_Theophysics_v4\04_THEOPYHISCS\[TX_A6.6] THE CONVERGENCE\THE CONVERGENCE 1 Story\A3_ARCHIVE\What Separates Us (old draft).md,41,92,You already know what this is.,descriptive,under-supported,False,False,False,False,False,False,False,under-supported,0.406
O:\_Theophysics_v4\04_THEOPYHISCS\[TX_A6.6] THE CONVERGENCE\THE CONVERGENCE 1 Story\A3_ARCHIVE\What Separates Us (old draft).md,42,99,"Something moves people toward each other — toward understanding, sacrifice, forgiveness, the willingness to hold a truth that costs you something.",predictive,under-supported,False,False,False,False,False,False,False,under-supported,0.4527
O:\_Theophysics_v4\04_THEOPYHISCS\[TX_A6.6] THE CONVERGENCE\THE CONVERGENCE 1 Story\A3_ARCHIVE\What Separates Us (old draft).md,43,100,"And something moves people away from each other — toward isolation, accusation, self-righteousness, the insistence that your partial truth is the whole truth and everyone else is the enemy.",descriptive,under-supported,False,False,False,False,False,False,False,under-supported,0.518
O:\_Theophysics_v4\04_THEOPYHISCS\[TX_A6.6] THE CONVERGENCE\THE CONVERGENCE 1 Story\A3_ARCHIVE\What Separates Us (old draft).md,44,101,You know what those two things are called.,descriptive,under-supported,False,False,False,False,False,False,False,under-supported,0.406
O:\_Theophysics_v4\04_THEOPYHISCS\[TX_A6.6] THE CONVERGENCE\THE CONVERGENCE 1 Story\A3_ARCHIVE\What Separates Us (old draft).md,45,103,You just stopped using the words because somewhere along the way someone convinced you they were naive.,causal,under-supported,False,False,True,False,False,False,False,under-supported,0.4993
O:\_Theophysics_v4\04_THEOPYHISCS\[TX_A6.6] THE CONVERGENCE\THE CONVERGENCE 1 Story\A3_ARCHIVE\What Separates Us (old draft).md,46,104,They're the only categories that survive when you strip everything else away.,descriptive,under-supported,False,False,False,False,False,False,False,under-supported,0.406
O:\_Theophysics_v4\04_THEOPYHISCS\[TX_A6.6] THE CONVERGENCE\THE CONVERGENCE 1 Story\A3_ARCHIVE\What Separates Us (old draft).md,47,112,And the reason nobody says it anymore isn't because it stopped being true.,causal,under-supported,False,False,True,False,False,False,False,under-supported,0.4993
O:\_Theophysics_v4\04_THEOPYHISCS\[TX_A6.6] THE CONVERGENCE\THE CONVERGENCE 1 Story\A3_ARCHIVE\What Separates Us (old draft).md,48,113,"It's because the fragmentation has gotten sophisticated enough to convince us that our particular divide is the *real* one — that if we could just fix the wealth gap, or the education gap, or the political gap, or the generational gap, things would hold together.",causal,under-supported,False,False,True,False,False,False,False,under-supported,0.4735
O:\_Theophysics_v4\04_THEOPYHISCS\[TX_A6.6] THE CONVERGENCE\THE CONVERGENCE 1 Story\A3_ARCHIVE\What Separates Us (old draft).md,49,121,"And when three different disciplines, using three different methodologies, converge on the same architecture — that's not coincidence.",descriptive,under-supported,False,False,False,False,False,False,False,under-supported,0.4527
O:\_Theophysics_v4\04_THEOPYHISCS\[TX_A6.6] THE CONVERGENCE\THE CONVERGENCE 1 Story\A3_ARCHIVE\What Separates Us (old draft).md,50,123,I've spent the last fifteen months building a mathematical framework that keeps finding the same pattern everywhere I point it.,descriptive,under-supported,False,False,False,False,False,False,False,under-supported,0.4527
O:\_Theophysics_v4\04_THEOPYHISCS\[TX_A6.6] THE CONVERGENCE\THE CONVERGENCE 1 Story\A3_ARCHIVE\What Separates Us (old draft).md,51,124,The next piece in this series goes into why entropy — the thing physics says tears everything apart — maps exactly onto what theology has always called evil.,descriptive,overstated,False,False,False,False,True,False,False,overstated,0.3137
O:\_Theophysics_v4\04_THEOPYHISCS\[TX_A6.6] THE CONVERGENCE\THE CONVERGENCE 1 Story\A3_ARCHIVE\What Separates Us (old draft).md,52,125,"I'll show you the equation.*

*[Subscribe to Convergence](https://convergence.substack.com) if you want to see what happens when the math stops flinching.*",descriptive,needs-review,True,False,False,False,False,False,False,needs-review,0.5567
